{
  "schema_version": "1.0.0",
  "manifest_id": "manifest.synthetic.001",
  "tenant_id": "tenant.synthetic.a",
  "recipient": { "type": "organization", "id": "recipient.synthetic.a" },
  "purpose": "Synthetic contract conformance",
  "created_at": "2030-01-01T00:02:00.000Z",
  "expires_at": "2030-01-02T00:02:00.000Z",
  "source_events": [
    {
      "source_event_id": "evt.synthetic.001",
      "content_digest": "sha256:1111111111111111111111111111111111111111111111111111111111111111"
    }
  ],
  "source_facts": [
    {
      "fact_id": "fact.source.001",
      "source_event_id": "evt.synthetic.001",
      "field_path": "/payload/count",
      "value_digest": "sha256:2222222222222222222222222222222222222222222222222222222222222222"
    }
  ],
  "derived_facts": [
    {
      "fact_id": "fact.derived.001",
      "input_fact_ids": ["fact.source.001"],
      "transform": { "id": "transform.synthetic.count", "version": "1.0.0" },
      "value_digest": "sha256:3333333333333333333333333333333333333333333333333333333333333333"
    }
  ],
  "conflicts": [
    {
      "conflict_id": "conflict.synthetic.001",
      "fact_ids": ["fact.source.001", "fact.derived.001"],
      "status": "unresolved"
    }
  ],
  "disclosed_fields": ["/source_facts/0"],
  "withheld_fields": [
    { "path": "/source_events/0/content", "reason_code": "purpose_minimization" }
  ],
  "missing_requirements": ["requirement.synthetic.001"],
  "consent_refs": ["consent.synthetic.001"],
  "retention": { "policy_id": "retention.synthetic.001", "expires_at": "2030-02-01T00:00:00.000Z" },
  "policy_ref": { "id": "policy.synthetic", "version": "1.0.0" },
  "release_identity": { "id": "release.synthetic", "version": "sha.synthetic" },
  "signature": {
    "algorithm": "Ed25519",
    "key_id": "key.synthetic.001",
    "value": "00000000000000000000000000000000000000000000000000000000000000000000000000000000000000000000000000000000000000000000000000000000"
  }
}
